{
  "note_path": "domains/natural_language_processing/Reflexion/README.md",
  "domain": "natural_language_processing",
  "topic": "Reflexion",
  "no_untrusted_code_executed": true,
  "generated_at": "2026-07-03T00:00:00Z",
  "entries": [
    {
      "claim_id": "tc-title",
      "claim_text": "Reflexion: Language Agents with Verbal Reinforcement Learning",
      "kind": "evidence-supported",
      "target": "table-cell:title",
      "source_url": "https://arxiv.org/abs/2303.11366",
      "retrieved_at": "2026-07-02T19:35:53Z",
      "quoted_snippet": "Verbal Reinforcement Learning"
    },
    {
      "claim_id": "tc-venue",
      "claim_text": "NeurIPS",
      "kind": "evidence-supported",
      "target": "table-cell:venue",
      "source_url": "https://dblp.org/rec/conf/nips/ShinnCGNY23",
      "retrieved_at": "2026-07-03T00:00:00Z",
      "quoted_snippet": "NeurIPS"
    },
    {
      "claim_id": "tc-year",
      "claim_text": "2023",
      "kind": "evidence-supported",
      "target": "table-cell:year",
      "source_url": "https://dblp.org/rec/conf/nips/ShinnCGNY23",
      "retrieved_at": "2026-07-03T00:00:00Z",
      "quoted_snippet": "2023"
    },
    {
      "claim_id": "tc-authors",
      "claim_text": "Noah Shinn, Federico Cassano, Edward Berman, Ashwin Gopinath, Karthik Narasimhan, Shunyu Yao",
      "kind": "evidence-supported",
      "target": "table-cell:authors",
      "source_url": "https://arxiv.org/abs/2303.11366",
      "retrieved_at": "2026-07-02T19:35:53Z",
      "quoted_snippet": "Noah Shinn"
    },
    {
      "claim_id": "tc-code",
      "claim_text": "https://github.com/noahshinn024/reflexion",
      "kind": "paper-claim",
      "target": "table-cell:official-code",
      "source_url": "https://arxiv.org/abs/2303.11366",
      "retrieved_at": "2026-07-02T19:35:53Z",
      "quoted_snippet": "https://github.com/noahshinn024/reflexion"
    },
    {
      "claim_id": "tc-venuekind",
      "claim_text": "paper",
      "kind": "evidence-supported",
      "target": "table-cell:venue-kind",
      "source_url": "https://dblp.org/rec/conf/nips/ShinnCGNY23",
      "retrieved_at": "2026-07-03T00:00:00Z",
      "quoted_snippet": "Conference and Workshop Papers"
    },
    {
      "claim_id": "fig-tasks",
      "claim_text": "Reflexion 在決策、程式、推理三類任務上運作的總覽圖",
      "kind": "evidence-supported",
      "target": "figure:imgs/reflexion_tasks.png",
      "source_url": "https://arxiv.org/abs/2303.11366",
      "retrieved_at": "2026-07-02T19:35:53Z",
      "quoted_snippet": "Reflexion works on decision-making"
    },
    {
      "claim_id": "fig-arch",
      "claim_text": "Actor–Evaluator–Self-reflection 迴圈與短長期記憶的架構圖",
      "kind": "evidence-supported",
      "target": "figure:imgs/reflexion_architecture.png",
      "source_url": "https://arxiv.org/abs/2303.11366",
      "retrieved_at": "2026-07-02T19:35:53Z",
      "quoted_snippet": "Diagram of Reflexion"
    },
    {
      "claim_id": "bp1",
      "claim_text": "本note依據 arXiv 預印本",
      "kind": "evidence-supported",
      "target": "note-section:body-prose-1",
      "source_url": "https://dblp.org/rec/conf/nips/ShinnCGNY23",
      "retrieved_at": "2026-07-03T00:00:00Z",
      "quoted_snippet": "NeurIPS"
    },
    {
      "claim_id": "bp2",
      "claim_text": "與其更新 weights，不如更新 agent 的 memory",
      "kind": "paper-claim",
      "target": "note-section:body-prose-2",
      "source_url": "https://arxiv.org/abs/2303.11366",
      "retrieved_at": "2026-07-02T19:35:53Z",
      "quoted_snippet": "traditional reinforcement learning methods require extensive training samples and expensive model fine-tuning"
    },
    {
      "claim_id": "bp3",
      "claim_text": "對成功沒有形式上的保證",
      "kind": "paper-claim",
      "target": "note-section:body-prose-3",
      "source_url": "https://arxiv.org/abs/2303.11366",
      "retrieved_at": "2026-07-02T19:35:53Z",
      "quoted_snippet": "not having a formal guarantee for success"
    },
    {
      "claim_id": "bp4",
      "claim_text": "也就是說學習發生在 memory 而非",
      "kind": "paper-claim",
      "target": "note-section:body-prose-4",
      "source_url": "https://arxiv.org/abs/2303.11366",
      "retrieved_at": "2026-07-02T19:35:53Z",
      "quoted_snippet": "utilizing three distinct models"
    },
    {
      "claim_id": "be1",
      "claim_text": "a_t \\sim \\pi_\\theta(a_t \\mid s_t)",
      "kind": "paper-claim",
      "target": "note-section:body-equation-1",
      "source_url": "https://arxiv.org/abs/2303.11366",
      "retrieved_at": "2026-07-02T19:35:53Z",
      "quoted_snippet": "we sample an action\nor generation, $a_t$, from the current policy"
    },
    {
      "claim_id": "bp5",
      "claim_text": "reasoning 任務用 exact match（EM）grading",
      "kind": "paper-claim",
      "target": "note-section:body-prose-5",
      "source_url": "https://arxiv.org/abs/2303.11366",
      "retrieved_at": "2026-07-02T19:35:53Z",
      "quoted_snippet": "we explore reward functions based on exact\nmatch (EM) grading"
    },
    {
      "claim_id": "bp6",
      "claim_text": "memory 被限制在最多",
      "kind": "paper-claim",
      "target": "note-section:body-prose-6",
      "source_url": "https://arxiv.org/abs/2303.11366",
      "retrieved_at": "2026-07-02T19:35:53Z",
      "quoted_snippet": "we bound \\emph{mem} by a maximum number of stored experiences"
    },
    {
      "claim_id": "be2",
      "claim_text": "\\mathit{mem} \\leftarrow \\mathit{mem} \\cup \\{sr_t\\}",
      "kind": "paper-claim",
      "target": "note-section:body-equation-2",
      "source_url": "https://arxiv.org/abs/2303.11366",
      "retrieved_at": "2026-07-02T19:35:53Z",
      "quoted_snippet": "After each trial $t$, $sr_t$, is appended"
    },
    {
      "claim_id": "bp7",
      "claim_text": "直到 Evaluator 判定通過",
      "kind": "paper-claim",
      "target": "note-section:body-prose-7",
      "source_url": "https://arxiv.org/abs/2303.11366",
      "retrieved_at": "2026-07-02T19:35:53Z",
      "quoted_snippet": "Reflexion is formalized as an iterative optimization process"
    },
    {
      "claim_id": "bc1",
      "claim_text": "Self-Reflection M_sr",
      "kind": "paper-claim",
      "target": "note-section:body-code-1",
      "source_url": "https://arxiv.org/abs/2303.11366",
      "retrieved_at": "2026-07-02T19:35:53Z",
      "quoted_snippet": "Initialize Actor, Evaluator, Self-Reflection"
    },
    {
      "claim_id": "bp8",
      "claim_text": "memory 上限只設為 1 筆經驗",
      "kind": "paper-claim",
      "target": "note-section:body-prose-8",
      "source_url": "https://arxiv.org/abs/2303.11366",
      "retrieved_at": "2026-07-02T19:35:53Z",
      "quoted_snippet": "We set $n$ to a maximum\nof 6 unit tests"
    },
    {
      "claim_id": "bp9",
      "claim_text": "從 baseline 的 0.80 推到 0.91",
      "kind": "paper-claim",
      "target": "note-section:body-prose-9",
      "source_url": "https://arxiv.org/abs/2303.11366",
      "retrieved_at": "2026-07-02T19:35:53Z",
      "quoted_snippet": "a 91\\% pass@1 accuracy on the HumanEval coding benchmark"
    },
    {
      "claim_id": "bp10",
      "claim_text": "false positive 測試執行率高達 16.3%",
      "kind": "paper-claim",
      "target": "note-section:body-prose-10",
      "source_url": "https://arxiv.org/abs/2303.11366",
      "retrieved_at": "2026-07-02T19:35:53Z",
      "quoted_snippet": "the false positive test execution rate for MBPP Python is 16.3\\%"
    },
    {
      "claim_id": "bt1",
      "claim_text": "HumanEval (PY)",
      "kind": "paper-claim",
      "target": "note-section:body-table-1",
      "source_url": "https://arxiv.org/abs/2303.11366",
      "retrieved_at": "2026-07-02T19:35:53Z",
      "quoted_snippet": "HumanEval (PY) & 65.8 (CodeT"
    },
    {
      "claim_id": "bp11",
      "claim_text": "在 134 個任務中完成 130 個",
      "kind": "paper-claim",
      "target": "note-section:body-prose-11",
      "source_url": "https://arxiv.org/abs/2303.11366",
      "retrieved_at": "2026-07-02T19:35:53Z",
      "quoted_snippet": "completing 130 out of 134 tasks"
    },
    {
      "claim_id": "cp1",
      "claim_text": "gradient-based RL 幾乎不可行",
      "kind": "reasonable-inference",
      "target": "note-section:critical-prose-1",
      "source_url": null,
      "retrieved_at": null,
      "quoted_snippet": "traditional reinforcement learning methods require extensive training samples and expensive model fine-tuning"
    },
    {
      "claim_id": "cp2",
      "claim_text": "沒有跨 seed 的變異或信賴區間",
      "kind": "unproven-or-doubtful",
      "target": "note-section:critical-prose-2",
      "source_url": null,
      "retrieved_at": null,
      "quoted_snippet": "using a temperature of 0.7"
    },
    {
      "claim_id": "cp3",
      "claim_text": "其貢獻是概念整合與命名",
      "kind": "reasonable-inference",
      "target": "note-section:critical-prose-3",
      "source_url": null,
      "retrieved_at": null,
      "quoted_snippet": "of these concepts can be enhanced with \\emph{self-reflection}"
    },
    {
      "claim_id": "cp4",
      "claim_text": "由作者自訂、規模僅 40 題的基準",
      "kind": "unproven-or-doubtful",
      "target": "note-section:critical-prose-4",
      "source_url": null,
      "retrieved_at": null,
      "quoted_snippet": "40 Leetcode hard-rated questions that have been released after\nOctober 8, 2022"
    },
    {
      "claim_id": "cp5",
      "claim_text": "當自我評估不可靠，反思會放大錯誤而非修正它",
      "kind": "reasonable-inference",
      "target": "note-section:critical-prose-5",
      "source_url": null,
      "retrieved_at": null,
      "quoted_snippet": "it may still succumb to non-optimal local\nminima solutions"
    }
  ]
}
