{
  "note_path": "domains/natural_language_processing/PromptLanguageCodingAccuracy/README.md",
  "domain": "natural_language_processing",
  "topic": "PromptLanguageCodingAccuracy",
  "no_untrusted_code_executed": true,
  "generated_at": "2026-07-03T15:30:08Z",
  "entries": [
    {
      "claim_id": "ac-title",
      "claim_text": "prompt language (English vs Chinese) change LLM coding accuracy",
      "kind": "reasonable-inference",
      "target": "table-cell:title",
      "source_url": "https://github.com/Aidenzich/road-to-master/issues/89",
      "retrieved_at": "2026-07-03T15:30:08Z",
      "quoted_snippet": ""
    },
    {
      "claim_id": "ac-year",
      "claim_text": "2024–2026",
      "kind": "reasonable-inference",
      "target": "table-cell:year",
      "source_url": "https://github.com/Aidenzich/road-to-master/issues/89",
      "retrieved_at": "2026-07-03T15:30:08Z",
      "quoted_snippet": ""
    },
    {
      "claim_id": "ac-venuekind",
      "claim_text": "survey",
      "kind": "reasonable-inference",
      "target": "table-cell:venue-kind",
      "source_url": "https://github.com/Aidenzich/road-to-master/issues/89",
      "retrieved_at": "2026-07-03T15:30:08Z",
      "quoted_snippet": ""
    },
    {
      "claim_id": "bp1",
      "claim_text": "凡本筆記保留的數值，皆以論文原文為準",
      "kind": "reasonable-inference",
      "target": "note-section:body-prose-1",
      "source_url": null,
      "retrieved_at": null,
      "quoted_snippet": ""
    },
    {
      "claim_id": "bt1",
      "claim_text": "A Multilingual Code Generation Benchmark",
      "kind": "paper-claim",
      "target": "note-section:body-table-1",
      "source_url": "https://arxiv.org/abs/2402.16694",
      "retrieved_at": "2026-07-03T15:30:08Z",
      "quoted_snippet": "A Multilingual Code Generation Benchmark for Cross-lingual Natural Language Generalization"
    },
    {
      "claim_id": "bp2",
      "claim_text": "來源 4 標示作者單位為 Scam.ai",
      "kind": "paper-claim",
      "target": "note-section:body-prose-2",
      "source_url": "https://arxiv.org/abs/2604.14210",
      "retrieved_at": "2026-07-03T15:30:08Z",
      "quoted_snippet": "A Preliminary Study on Token Cost and Problem-Solving Rate"
    },
    {
      "claim_id": "bp3",
      "claim_text": "差距通常落在 0–8 個百分點之間",
      "kind": "reasonable-inference",
      "target": "note-section:body-prose-3",
      "source_url": null,
      "retrieved_at": null,
      "quoted_snippet": ""
    },
    {
      "claim_id": "bp4",
      "claim_text": "英文與中文都是 47.50 pass@1",
      "kind": "evidence-supported",
      "target": "note-section:body-prose-4",
      "source_url": "https://arxiv.org/abs/2402.16694",
      "retrieved_at": "2026-07-03T15:30:08Z",
      "quoted_snippet": "Chinese & 0.00 & 1.25 & 0.00 & 3.75 & 10.00 & 17.50 & 18.75 & 2.50 & 47.50"
    },
    {
      "claim_id": "bp5",
      "claim_text": "pass@1「至少下降 13%」",
      "kind": "paper-claim",
      "target": "note-section:body-prose-5",
      "source_url": "https://arxiv.org/abs/2404.19368",
      "retrieved_at": "2026-07-03T15:30:08Z",
      "quoted_snippet": "when using Chinese instructions, the code generation capabilities of LCMs decrease by at least 13\\%"
    },
    {
      "claim_id": "bp6",
      "claim_text": "平均正確率在低溫（t=0.2）時中文 0.58 反而略高於英文 0.56",
      "kind": "paper-claim",
      "target": "note-section:body-prose-6",
      "source_url": "https://arxiv.org/abs/2406.00602",
      "retrieved_at": "2026-07-03T15:30:08Z",
      "quoted_snippet": "GPT-4 & \\cellcolor[HTML]{D9EAD3}0.65 & 0.63 & 0.61 & 0.06 & \\cellcolor[HTML]{D9EAD3}0.71 & 0.65 & 0.65 & 0.06 \\\\ \\hline \\multicolumn{1}{l}{} & Average & 0.56 & \\cellcolor[HTML]{FCE5CD}0.58 & 0.51 & 0.11 & \\cellcolor[HTML]{D9EAD3}0.61 & 0.59"
    },
    {
      "claim_id": "bp6b",
      "claim_text": "平均約 12% 的題目會出現一語言對、另一語言錯的不一致",
      "kind": "paper-claim",
      "target": "note-section:body-prose-6b",
      "source_url": "https://arxiv.org/abs/2406.00602",
      "retrieved_at": "2026-07-03T15:30:08Z",
      "quoted_snippet": "different correctness on an average of 12\\% bilingual programming tasks"
    },
    {
      "claim_id": "bt2",
      "claim_text": "37.32",
      "kind": "evidence-supported",
      "target": "note-section:body-table-2",
      "source_url": "https://arxiv.org/abs/2404.19368",
      "retrieved_at": "2026-07-03T15:30:08Z",
      "quoted_snippet": "22.56 & 26.82 & 31.70 & 31.09 & 35.36 &54.87& 28.65 & 49.39 & 55.48 & 37.32"
    },
    {
      "claim_id": "bp7",
      "claim_text": "GPT-4 的 English 列與 Chinese 列在 Go 欄位都是 47.50",
      "kind": "evidence-supported",
      "target": "note-section:body-prose-7",
      "source_url": "https://arxiv.org/abs/2402.16694",
      "retrieved_at": "2026-07-03T15:30:08Z",
      "quoted_snippet": "English & 0.00 & 1.25 & 0.00 & 2.50 & 10.00 & 12.50 & 13.75 & 2.50 & 47.50"
    },
    {
      "claim_id": "bp8",
      "claim_text": "MiniMax-2.7 英文 66.0% vs 中文 61.5%",
      "kind": "paper-claim",
      "target": "note-section:body-prose-8",
      "source_url": "https://arxiv.org/abs/2604.14210",
      "retrieved_at": "2026-07-03T15:30:08Z",
      "quoted_snippet": "MiniMax-2.7 achieves 66.0\\% resolution on English and 61.5\\% on Chinese"
    },
    {
      "claim_id": "bp9",
      "claim_text": "MiniMax-2.7 中文只有 39 題可評",
      "kind": "paper-claim",
      "target": "note-section:body-prose-9",
      "source_url": "https://arxiv.org/abs/2604.14210",
      "retrieved_at": "2026-07-03T15:30:08Z",
      "quoted_snippet": "MiniMax-2.7 ZH dropped to 39 evaluable instances"
    },
    {
      "claim_id": "bt3",
      "claim_text": "66.0%",
      "kind": "evidence-supported",
      "target": "note-section:body-table-3",
      "source_url": "https://arxiv.org/abs/2604.14210",
      "retrieved_at": "2026-07-03T15:30:08Z",
      "quoted_snippet": "MiniMax-2.7 & EN & 50 & 33 & 66.0\\% & 298,720 & 61,762 & 22,368"
    },
    {
      "claim_id": "bp10",
      "claim_text": "MiniMax-2.7 中文要 1.28× 的 token",
      "kind": "paper-claim",
      "target": "note-section:body-prose-10",
      "source_url": "https://arxiv.org/abs/2604.14210",
      "retrieved_at": "2026-07-03T15:30:08Z",
      "quoted_snippet": "Chinese prompts require 1.28x more tokens than English"
    },
    {
      "claim_id": "bp11",
      "claim_text": "把最容易被 token 化與翻譯扭曲的技術符號維持英文原樣",
      "kind": "reasonable-inference",
      "target": "note-section:body-prose-11",
      "source_url": null,
      "retrieved_at": null,
      "quoted_snippet": ""
    },
    {
      "claim_id": "cp1",
      "claim_text": "它們的指標不同",
      "kind": "reasonable-inference",
      "target": "note-section:critical-prose-1",
      "source_url": null,
      "retrieved_at": null,
      "quoted_snippet": ""
    },
    {
      "claim_id": "cp2",
      "claim_text": "翻譯品質本身就是混淆變項",
      "kind": "unproven-or-doubtful",
      "target": "note-section:critical-prose-2",
      "source_url": null,
      "retrieved_at": null,
      "quoted_snippet": ""
    },
    {
      "claim_id": "cp3",
      "claim_text": "50 題規模下 4.5 pp 的差距很可能落在雜訊內",
      "kind": "reasonable-inference",
      "target": "note-section:critical-prose-3",
      "source_url": "https://arxiv.org/abs/2604.14210",
      "retrieved_at": "2026-07-03T15:30:08Z",
      "quoted_snippet": "we do not perform formal significance testing"
    },
    {
      "claim_id": "cp4",
      "claim_text": "沒有任何來源提供現世代模型",
      "kind": "unproven-or-doubtful",
      "target": "note-section:critical-prose-4",
      "source_url": null,
      "retrieved_at": null,
      "quoted_snippet": ""
    }
  ]
}
